"通汇金融代号","总单位名称","帐号长度","地址","电话"
"617","竹崎鹿草嘉市民雄溪口梅山义竹东石番路","","大林太保大埔朴子六脚水上布袋新港","07 7439121"
"通汇金融代号","支单位名称","地址","电话"
"6170046","大林镇农会","嘉义县大林镇中山路１３０号","05 2653121"
"6170264","吉林分部","嘉义县大林镇新兴路５号","05 2652261"
"6170275","沟背分部","嘉义县大林镇义和里１邻２之６号","05 2953931"
"6170286","大美分部","嘉义县大林镇大美里１４邻１６８号","05 2954551"
"6170297","排路分部","嘉义县大林镇排路里５邻８４号","05 2694552"
"6170781","中林分部","嘉义县大林镇中林里７０∣５号","05 2654524"
"6171467","中坑分部","嘉义县大林镇中坑里沙仑４邻１２１号","05 2950529"
"6170172","蒜头分部","嘉义县六脚乡蒜头村１２５号","05 3804533"
"6170666","港尾寮分部","嘉义县六脚乡丰美村１６０号","05 3802033"
"6170677","六脚分部","嘉义县六脚乡六脚村３号","05 3781631"
"6170688","湾内分部","嘉义县六脚乡湾南村３１∣５号","05 3802049"
"6170703","更寮分部","嘉义县六脚乡正义村２１１号","05 3793630"
"6170806","六脚乡农会","嘉义县六脚乡蒜头村７∣２０号","05 3802816"
"6171434","苏仑分部","嘉义县六脚乡苏厝村２之３号","05 7812170"
"6170105","太保市农会","嘉义县太保市太保里５８号","05 3711101"
"6170437","后潭分部","嘉义县太保市后潭里３７４之７号","05 3711014"
"6170448","新埤分部","嘉义县太保市新埤路６号","05 3611940"
"6170459","南新分部","嘉义县太保市中山路一段２４５号","05 2373012"
"6170758","嘉太分部","嘉义县太保市麻寮里麻太路３２∣１号","05 2375676"
"6171412","安东分部","嘉义县太保市新埤路６号","05 3621022"
"6170116","水上乡农会","嘉义县水上乡中和路１９号","05 2682010"
"6170460","成功分部","嘉义县水上乡三界村１５０号","05 2395514"
"6170471","南靖分部","嘉义县水上乡三镇村３５号","05 2682015"
"6170482","大仑分部","嘉义县水上乡大仑村１３６∣１号","05 3711243"
"6170493","忠和分部","嘉义县水上乡中庄村７１∣１２０号","05 2890220"
"6170507","北回分部","嘉义县水上乡回归村２１７号","05 2356502"
"6170518","柳林分部","嘉义县水上乡柳乡村１００∣１４号","05 2683274"
"6170725","民生分部","嘉义县水上乡民生村立业街３巷２∣２号","05 2360386"
"6170035","布袋镇农会","嘉义县布袋镇太平路１１６号","05 3472024"
"6170242","过沟分部","嘉义县布袋镇中安里６号","05 3451003"
"6170253","永安分部","嘉义县布袋镇东港里埔厝８６号","05 3471660"
"6170769","新厝分部","嘉义县布袋镇龙江里２８４号","05 3474090"
"6171375","新塭办事处","嘉义县布袋镇复兴里６７号","05 3431050"
"6170057","民雄乡农会","嘉义县民雄乡中乐村民族路４２号","05 2267151"
"6170301","北斗分部","嘉义县民雄乡北斗村５６∣１号","05 2219748"
"6170312","山中分部","嘉义县民雄乡山中村７８之１号","05 2212862"
"6170323","菁埔分部","嘉义县民雄乡菁埔村１５２之１１号","05 2265372"
"6170714","秀林分部","嘉义县民雄乡秀林村１之５１号","05 2215380"
"6171478","三兴分部","嘉义县民雄乡三兴村陈厝寮２７号","05 2720233"
"6171489","兴南分部","嘉义县民雄乡兴南村头桥５０号","05 2212413"
"6170024","朴子市农会","嘉义县朴子市山通路１０２号","05 3794102"
"6170219","开元分部","嘉义县朴子市开元路２６７号","05 3794120"
"6170220","文化分部","嘉义县朴子市第二市场十栋２号","05 3794129"
"6170231","松梅分部","嘉义县朴子市牛挑湾１５３号","05 3695021"
"6171353","大慷榔分部","嘉义县朴子市大慷榔８０号","05 3794154"
"6171364","双溪口分部","嘉义县朴子市双溪口１４８号","05 3794150"
"6170149","竹崎地区农会","嘉义县竹崎乡竹崎村中正路１１１号","05 2612120"
"6170574","内埔分部","嘉义县竹崎乡内埔村元兴路１２９号","05 2541003"
"6170585","湾桥分部","嘉义县竹崎乡湾桥村湾桥１８９号","05 2790103"
"6170596","东义分部","嘉义县竹崎乡狮埜村火炭埔１９∣１号","05 2110003"
"6170699","大埔分部","嘉义县大埔乡大埔村大埔２５７号","05 2521410"
"6171423","石棹分部","嘉义县竹崎乡中和村石棹２２∣１５号","05 2561144"
"6171490","鹿满分部","嘉义县竹崎乡紫云村鹿寮崛３５号","05 2615781"
"6170079","东石乡农会","嘉义县东石乡港前村６０号","05 3799184"
"6170356","东石分部","嘉义县东石乡元树村１４７号","05 3731418"
"6170367","副濑分部","嘉义县东石乡副濑村１０邻７９号","05 3732331"
"6170378","下楫分部","嘉义县东石乡下楫村８４－８号","05 3601451"
"6170389","西仑分部","嘉义县东石乡西仑村５６－３号","05 3451523"
"6170150","梅山乡农会","嘉义县梅山乡梅南村中山路１２７号","05 2622100"
"6170600","瑞里分部","嘉义县梅山乡瑞里村１０号","05 2501030"
"6170611","太平分部","嘉义县梅山乡太平村４８号","05 2571052"
"6170622","太和分部","嘉义县梅山乡太和村蛤里味３７∣１号","05 2661074"
"6170091","鹿草乡农会","嘉义县鹿草乡西井村２８８号","05 3752911"
"6170415","下潭分部","嘉义县鹿草乡下潭村４５９号","05 3651339"
"6170426","后土屈分部","嘉义县鹿草乡后土屈村后土屈６４－７号","05 3752497"
"6171331","重寮分部","嘉义县鹿草乡重寮村９０号","05 3752797"
"6171401","松山分部","嘉义县鹿草乡竹山村２１９号","05 3650152"
"6170138","番路乡农会","嘉义县番路乡菜公店５９号","05 2592360"
"6170563","触口分部","嘉义县番路乡触口村触口１３７之１号","05 2591314"
"6171320","隙顶分部","嘉义县番路乡公田村隙顶２４之２号","05 2586418"
"6170633","月眉分部","嘉义县新港乡月眉村２４号","05 3771369"
"6170644","大潭分部","嘉义县新港乡大潭村９１号","05 3743034"
"6170655","仑子分部","嘉义县新港乡南仑村１０５∣４号","05 3760045"
"6170817","新港乡农会","嘉义县新港乡福德村登云路１１１巷２号","05 3741148"
"6171261","安和分部","嘉义县新港乡安和村９２之１号","05 3770804"
"6170068","溪口乡农会","嘉义县溪口乡民生街８０号","05 2691845"
"6170334","柴林分部","嘉义县溪口乡林脚村３９号","05 2691313"
"6170345","仑尾分部","嘉义县溪口乡美北村９∣３号","05 2691314"
"6171386","柳沟分部","嘉义县溪口乡柳沟村柳沟路４７号","05 2694100"
"6170080","义竹乡农会","嘉义县义竹乡仁里村４２１号","05 3411301"
"6170390","过路分部","嘉义县义竹乡西过村４２７号","05 3437184"
"6170404","光荣分部","嘉义县义竹乡东光村１６２号","05 3421154"
"6171397","新店分部","嘉义县义竹乡新店村１２９之７号","05 3427310"
"6170013","吴凤分部","嘉义市吴凤北路２９１号","05 2242171"
"6170194","福全分部","嘉义市北港路２５号","05 2333950"
"6170208","北兴分部","嘉义市北兴街１７５之１号","05 2326108"
"6170862","嘉义市农会","嘉义市北港路２５１号","05 2331637"
"6171272","宣信分部","嘉义市宣信街２５９号","05 2237243"
"6171283","民生分部","嘉义市杭州三街１号","05 2254731"