"通汇金融代号","总单位名称","帐号长度","地址","电话"
"903","台北县汐止市农会","11位","台北县汐止市新台五路一段２０７号","02 26416666"
"通汇金融代号","支单位名称","地址","电话"
"9030109","信用部","台北县汐止市新台五路一段２０７号","02 26416666"
"9030110","社后分部","台北县汐止市康宁街４１２号","02 26952621"
"9030121","横科分部","台北县汐止市宜兴街２６号","02 26602288"
"9030132","白云分部","台北县汐止市力行街５号","02 26402200"
"9030143","大新分部","台北县汐止市忠孝东路２４０号","02 26432222"
"9030154","中兴分部","台北县汐止市福德一路２５８号","02 26946560"
"9030165","中正分部","台北县汐止市中正路１０４号","02 26413333"
"9030176","樟树分部","台北县汐止市樟树一路１５６号","02 26476976"
"9030187","大同分部","台北县汐止市建成路７８号","02 26480842"